{
  "$schema": "../../system/schemas/metaObjectStorableSettings.schema.json",
  "uid": "f1a2b3c4-d5e6-4789-9abc-def012345678",
  "metaObjectKindUid": "5449a8ad-9359-41b2-8ff2-3f415eb4da76",
  "title": "Вид договора",
  "name": "contract_kind",
  "memo": "Виды договоров: аренды, поставки, лизинг и т.п.",
  "editMethod": 0,
  "orderByExpression": "",
  "displayExpression": "",
  "listFormUid": null,
  "itemFormUid": null,
  "showMainImage": false,
  "version": 0,
  "isActive": true,
  "header": {
    "uid": "e2b3c4d5-e6f7-489a-9bcd-ef0123456789",
    "title": "header",
    "name": "header",
    "memo": "",
    "autoClearMethod": 0,
    "columns": [
      {
        "uid": "d3c4d5e6-f7a8-49ab-9cde-f01234567890",
        "kind": 0,
        "standardColumnUid": "3cceebad-7d5a-4943-a102-6267e22227a8",
        "title": "Имя",
        "name": "name",
        "formula": "",
        "itemsSource": "",
        "autoClearMethod": 0,
        "isStandard": true,
        "dataSettings": {
          "dataTypeUid": "0234c067-7868-46b2-ba8e-e22fae5255cb",
          "stringLength": 20,
          "numberDigits": 2,
          "primaryKey": true,
          "required": false,
          "unique": false,
          "defaultValue": null
        },
        "renderSettings": {
          "controlKindUid": "",
          "showInItem": true,
          "showInList": true,
          "listColumnWidth": ""
        },
        "dependencies": []
      },
      {
        "uid": "c4d5e6f7-a8b9-4abc-9def-012345678901",
        "kind": 0,
        "standardColumnUid": "1e0063d0-288d-494a-8761-1185300d571d",
        "title": "Удалено",
        "name": "is_deleted",
        "formula": "",
        "itemsSource": "",
        "autoClearMethod": 0,
        "isStandard": true,
        "dataSettings": {
          "dataTypeUid": "4bff64cf-eb01-4933-9f3d-b902336751f4",
          "stringLength": 100,
          "numberDigits": 2,
          "primaryKey": false,
          "required": false,
          "unique": false,
          "defaultValue": null
        },
        "renderSettings": {
          "controlKindUid": "",
          "showInItem": true,
          "showInList": false,
          "listColumnWidth": ""
        },
        "dependencies": []
      },
      {
        "uid": "b5e6f7a8-b9ca-4bcd-9ef0-123456789012",
        "kind": 0,
        "standardColumnUid": "e647fb57-470e-4547-9a94-2be0f3d0985e",
        "title": "Код",
        "name": "code",
        "formula": "",
        "itemsSource": "",
        "autoClearMethod": 0,
        "isStandard": true,
        "dataSettings": {
          "dataTypeUid": "0234c067-7868-46b2-ba8e-e22fae5255cb",
          "stringLength": 3,
          "numberDigits": 2,
          "primaryKey": false,
          "required": true,
          "unique": true,
          "defaultValue": null
        },
        "renderSettings": {
          "controlKindUid": "",
          "showInItem": true,
          "showInList": true,
          "listColumnWidth": ""
        },
        "dependencies": []
      },
      {
        "uid": "a6f7a8b9-cadb-4cde-9f01-234567890123",
        "kind": 0,
        "standardColumnUid": "91a26ae4-5723-4109-8322-7e4e59129239",
        "title": "Заголовок",
        "name": "title",
        "formula": "",
        "itemsSource": "",
        "autoClearMethod": 0,
        "isStandard": true,
        "dataSettings": {
          "dataTypeUid": "0234c067-7868-46b2-ba8e-e22fae5255cb",
          "stringLength": 100,
          "numberDigits": 2,
          "primaryKey": false,
          "required": true,
          "unique": false,
          "defaultValue": null
        },
        "renderSettings": {
          "controlKindUid": "",
          "showInItem": true,
          "showInList": true,
          "listColumnWidth": ""
        },
        "dependencies": []
      }
    ],
    "indexes": [
      {
        "uid": "97a8b9ca-dbec-4def-9012-345678901234",
        "columns": [
          {
            "columnUid": "c4d5e6f7-a8b9-4abc-9def-012345678901",
            "direction": 0
          }
        ]
      },
      {
        "uid": "88b9cadb-ecfd-4ef0-9123-456789012345",
        "columns": [
          {
            "columnUid": "b5e6f7a8-b9ca-4bcd-9ef0-123456789012",
            "direction": 0
          }
        ]
      }
    ]
  },
  "detailTables": [],
  "commands": [],
  "recordsSources": [],
  "recordsSettings": []
}