{
  "$schema": "../../system/schemas/metaObjectStorableSettings.schema.json",
  "uid": "c1d2e3f4-a5b6-47c8-9d0e-1f2a3b4c5d6e",
  "metaObjectKindUid": "5449a8ad-9359-41b2-8ff2-3f415eb4da76",
  "title": "Роль согласования",
  "name": "approval_role",
  "memo": "Роль участника в процессе согласования договора",
  "editMethod": 0,
  "orderByExpression": "",
  "displayExpression": "",
  "listFormUid": null,
  "itemFormUid": null,
  "showMainImage": false,
  "saveHistory": 0,
  "version": 0,
  "isActive": true,
  "header": {
    "uid": "d2e3f4a5-b6c7-48d9-8e0f-2a3b4c5d6e7f",
    "title": "header",
    "name": "header",
    "memo": "",
    "autoClearMethod": 0,
    "columns": [
      {
        "uid": "e3f4a5b6-c7d8-49e0-9f1a-3b4c5d6e7f80",
        "kind": 0,
        "standardColumnUid": "3cceebad-7d5a-4943-a102-6267e22227a8",
        "title": "Имя",
        "name": "name",
        "formula": "",
        "itemsSource": "",
        "autoClearMethod": 0,
        "isStandard": true,
        "dataSettings": {
          "dataTypeUid": "0234c067-7868-46b2-ba8e-e22fae5255cb",
          "stringLength": 20,
          "numberDigits": 2,
          "primaryKey": true,
          "required": false,
          "unique": false,
          "defaultValue": null
        },
        "renderSettings": {
          "controlKindUid": "",
          "showInItem": true,
          "showInList": true,
          "listColumnWidth": ""
        },
        "dependencies": []
      },
      {
        "uid": "f4a5b6c7-d8e9-4a01-8b2c-4d5e6f708192",
        "kind": 0,
        "standardColumnUid": "1e0063d0-288d-494a-8761-1185300d571d",
        "title": "Удалено",
        "name": "is_deleted",
        "formula": "",
        "itemsSource": "",
        "autoClearMethod": 0,
        "isStandard": true,
        "dataSettings": {
          "dataTypeUid": "4bff64cf-eb01-4933-9f3d-b902336751f4",
          "stringLength": 100,
          "numberDigits": 2,
          "primaryKey": false,
          "required": false,
          "unique": false,
          "defaultValue": null
        },
        "renderSettings": {
          "controlKindUid": "",
          "showInItem": true,
          "showInList": false,
          "listColumnWidth": ""
        },
        "dependencies": []
      },
      {
        "uid": "a5b6c7d8-e9f0-4b12-9c3d-5e6f70819203",
        "kind": 0,
        "standardColumnUid": "e647fb57-470e-4547-9a94-2be0f3d0985e",
        "title": "Код",
        "name": "code",
        "formula": "",
        "itemsSource": "",
        "autoClearMethod": 0,
        "isStandard": true,
        "dataSettings": {
          "dataTypeUid": "0234c067-7868-46b2-ba8e-e22fae5255cb",
          "stringLength": 3,
          "numberDigits": 2,
          "primaryKey": false,
          "required": true,
          "unique": true,
          "defaultValue": null
        },
        "renderSettings": {
          "controlKindUid": "",
          "showInItem": true,
          "showInList": true,
          "listColumnWidth": ""
        },
        "dependencies": []
      },
      {
        "uid": "b6c7d8e9-f0a1-4c23-8d4e-6f7081920314",
        "kind": 0,
        "standardColumnUid": "91a26ae4-5723-4109-8322-7e4e59129239",
        "title": "Заголовок",
        "name": "title",
        "formula": "",
        "itemsSource": "",
        "autoClearMethod": 0,
        "isStandard": true,
        "dataSettings": {
          "dataTypeUid": "0234c067-7868-46b2-ba8e-e22fae5255cb",
          "stringLength": 100,
          "numberDigits": 2,
          "primaryKey": false,
          "required": true,
          "unique": false,
          "defaultValue": null
        },
        "renderSettings": {
          "controlKindUid": "",
          "showInItem": true,
          "showInList": true,
          "listColumnWidth": ""
        },
        "dependencies": []
      }
    ],
    "indexes": [
      {
        "uid": "c7d8e9f0-a1b2-4d34-9e5f-708192031425",
        "columns": [
          {
            "columnUid": "f4a5b6c7-d8e9-4a01-8b2c-4d5e6f708192",
            "direction": 0
          }
        ]
      },
      {
        "uid": "d8e9f0a1-b2c3-4e45-8f60-819203142536",
        "columns": [
          {
            "columnUid": "a5b6c7d8-e9f0-4b12-9c3d-5e6f70819203",
            "direction": 0
          }
        ]
      }
    ]
  },
  "detailTables": [],
  "commands": [],
  "recordsSources": [],
  "recordsSettings": []
}