{
  "$schema": "../../system/schemas/metaObjectStorableSettings.schema.json",
  "uid": "a3f1b8e2-7c4d-4a5b-9e6f-1d2c3b4a5e6f",
  "metaObjectKindUid": "5449a8ad-9359-41b2-8ff2-3f415eb4da76",
  "title": "Статус договора",
  "name": "contract_status",
  "memo": "Возможные статусы договора в процессе согласования и исполнения",
  "editMethod": 0,
  "orderByExpression": "",
  "displayExpression": "",
  "listFormUid": null,
  "itemFormUid": null,
  "showMainImage": false,
  "saveHistory": 0,
  "version": 0,
  "isActive": true,
  "header": {
    "uid": "b4e2c9f3-8d5e-4b6c-af7a-2e3d4c5b6f7a",
    "title": "header",
    "name": "header",
    "memo": "",
    "autoClearMethod": 0,
    "columns": [
      {
        "uid": "c5f3dae4-9e6f-4c7d-bb8b-3f4e5d6c7a8b",
        "kind": 0,
        "standardColumnUid": "3cceebad-7d5a-4943-a102-6267e22227a8",
        "title": "Имя",
        "name": "name",
        "formula": "",
        "itemsSource": "",
        "autoClearMethod": 0,
        "isStandard": true,
        "dataSettings": {
          "dataTypeUid": "0234c067-7868-46b2-ba8e-e22fae5255cb",
          "stringLength": 20,
          "numberDigits": 2,
          "primaryKey": true,
          "required": false,
          "unique": false,
          "defaultValue": null
        },
        "renderSettings": {
          "controlKindUid": "",
          "showInItem": true,
          "showInList": true,
          "listColumnWidth": ""
        },
        "dependencies": []
      },
      {
        "uid": "d6e4ebf5-af70-4d8e-9c9c-4f5d6e7a8b9c",
        "kind": 0,
        "standardColumnUid": "1e0063d0-288d-494a-8761-1185300d571d",
        "title": "Удалено",
        "name": "is_deleted",
        "formula": "",
        "itemsSource": "",
        "autoClearMethod": 0,
        "isStandard": true,
        "dataSettings": {
          "dataTypeUid": "4bff64cf-eb01-4933-9f3d-b902336751f4",
          "stringLength": 100,
          "numberDigits": 2,
          "primaryKey": false,
          "required": false,
          "unique": false,
          "defaultValue": null
        },
        "renderSettings": {
          "controlKindUid": "",
          "showInItem": true,
          "showInList": false,
          "listColumnWidth": ""
        },
        "dependencies": []
      },
      {
        "uid": "e7f5fc06-bf81-4e9f-9dad-5f6e7a8b9c0d",
        "kind": 0,
        "standardColumnUid": "e647fb57-470e-4547-9a94-2be0f3d0985e",
        "title": "Код",
        "name": "code",
        "formula": "",
        "itemsSource": "",
        "autoClearMethod": 0,
        "isStandard": true,
        "dataSettings": {
          "dataTypeUid": "0234c067-7868-46b2-ba8e-e22fae5255cb",
          "stringLength": 3,
          "numberDigits": 2,
          "primaryKey": false,
          "required": true,
          "unique": true,
          "defaultValue": null
        },
        "renderSettings": {
          "controlKindUid": "",
          "showInItem": true,
          "showInList": true,
          "listColumnWidth": ""
        },
        "dependencies": []
      },
      {
        "uid": "f8e6cd17-c092-4faf-aebe-6e7a8b9c0d1e",
        "kind": 0,
        "standardColumnUid": "91a26ae4-5723-4109-8322-7e4e59129239",
        "title": "Заголовок",
        "name": "title",
        "formula": "",
        "itemsSource": "",
        "autoClearMethod": 0,
        "isStandard": true,
        "dataSettings": {
          "dataTypeUid": "0234c067-7868-46b2-ba8e-e22fae5255cb",
          "stringLength": 100,
          "numberDigits": 2,
          "primaryKey": false,
          "required": true,
          "unique": false,
          "defaultValue": null
        },
        "renderSettings": {
          "controlKindUid": "",
          "showInItem": true,
          "showInList": true,
          "listColumnWidth": ""
        },
        "dependencies": []
      }
    ],
    "indexes": [
      {
        "uid": "a9f7de28-d1a3-4ab0-aacf-7a8b9c0d1e2f",
        "columns": [
          {
            "columnUid": "d6e4ebf5-af70-4d8e-9c9c-4f5d6e7a8b9c",
            "direction": 0
          }
        ]
      },
      {
        "uid": "bae8ef39-e2b4-4bc1-bbe0-8b9c0d1e2f3a",
        "columns": [
          {
            "columnUid": "e7f5fc06-bf81-4e9f-9dad-5f6e7a8b9c0d",
            "direction": 0
          }
        ]
      }
    ]
  },
  "detailTables": [],
  "commands": [],
  "recordsSources": [],
  "recordsSettings": []
}